{
 "id": "rule.fuego",
 "name": "Fuego",
 "text": "Una criatura u objeto que arda sufre 1d4 de daño de fuego al principio de cada uno de sus turnos. Como acción, puedes apagar el fuego que te afecta adoptando el estado de derribado y rodando por el suelo. El fuego también se extingue si se empapa, se sumerge o se ahoga.",
 "blocks": [
  {
   "type": "paragraph",
   "page": 201,
   "md": "Una criatura u objeto que arda sufre 1d4 de daño de fuego al principio de cada uno de sus turnos. Como acción, puedes apagar el fuego que te afecta adoptando el estado de derribado y rodando por el suelo. El fuego también se extingue si se empapa, se sumerge o se ahoga.",
   "text": "Una criatura u objeto que arda sufre 1d4 de daño de fuego al principio de cada uno de sus turnos. Como acción, puedes apagar el fuego que te afecta adoptando el estado de derribado y rodando por el suelo. El fuego también se extingue si se empapa, se sumerge o se ahoga."
  }
 ],
 "source": {
  "book": "SRD 5.2.1 es",
  "page": 201
 },
 "kind": "peligro"
}