{
 "id": "rule.truco",
 "name": "Truco",
 "text": "Un truco es un conjuro de nivel 0 que se lanza sin un espacio de conjuro. Consulta también el capítulo “Conjuros”.",
 "blocks": [
  {
   "type": "paragraph",
   "page": 209,
   "md": "Un truco es un conjuro de nivel 0 que se lanza sin un espacio de conjuro. *Consulta también* el capítulo “Conjuros”.",
   "text": "Un truco es un conjuro de nivel 0 que se lanza sin un espacio de conjuro. Consulta también el capítulo “Conjuros”."
  }
 ],
 "source": {
  "book": "SRD 5.2.1 es",
  "page": 209
 }
}