{
 "id": "rule.valor-de-desafio",
 "name": "Valor de desafío",
 "text": "El valor de desafío (VD) resume la amenaza que supone un monstruo para un grupo de cuatro personajes jugadores. Compara el VD del monstruo con el nivel de los personajes. Si el VD es superior, el monstruo seguramente suponga un peligro. Si el VD es inferior, el monstruo probablemente no sea una gran amenaza. No obstante, las circunstancias y la cantidad de personajes jugadores pueden alterar considerablemente lo peligroso que puede ser un monstruo en realidad. En el capítulo “Herramientas del juego” (“Encuentros de combate”) se explica cómo usar el VD al planear posibles encuentros de combate. Consulta también “Perfil”.",
 "blocks": [
  {
   "type": "paragraph",
   "page": 209,
   "md": "El valor de desafío (VD) resume la amenaza que supone un monstruo para un grupo de cuatro personajes jugadores. Compara el VD del monstruo con el nivel de los personajes. Si el VD es superior, el monstruo seguramente suponga un peligro. Si el VD es inferior, el monstruo probablemente no sea una gran amenaza. No obstante, las circunstancias y la cantidad de personajes jugadores pueden alterar considerablemente lo peligroso que puede ser un monstruo en realidad. En el capítulo “Herramientas del juego” (“Encuentros de combate”) se explica cómo usar el VD al planear posibles encuentros de combate. *Consulta también* “Perfil”.",
   "text": "El valor de desafío (VD) resume la amenaza que supone un monstruo para un grupo de cuatro personajes jugadores. Compara el VD del monstruo con el nivel de los personajes. Si el VD es superior, el monstruo seguramente suponga un peligro. Si el VD es inferior, el monstruo probablemente no sea una gran amenaza. No obstante, las circunstancias y la cantidad de personajes jugadores pueden alterar considerablemente lo peligroso que puede ser un monstruo en realidad. En el capítulo “Herramientas del juego” (“Encuentros de combate”) se explica cómo usar el VD al planear posibles encuentros de combate. Consulta también “Perfil”."
  }
 ],
 "source": {
  "book": "SRD 5.2.1 es",
  "page": 209
 }
}