{
 "id": "rule.prueba-de-caracteristica",
 "name": "Prueba de característica",
 "text": "Una prueba de característica es una prueba con d20 que representa el uso de una de las seis características (o de una habilidad asociada a una característica) para superar un desafío. Consulta también el capítulo “Cómo jugar” (“Las pruebas con d20” y “Competencia”).",
 "blocks": [
  {
   "type": "paragraph",
   "page": 206,
   "md": "Una prueba de característica es una prueba con d20 que representa el uso de una de las seis características (o de una habilidad asociada a una característica) para superar un desafío. *Consulta también* el capítulo “Cómo jugar” (“Las pruebas con d20” y “Competencia”).",
   "text": "Una prueba de característica es una prueba con d20 que representa el uso de una de las seis características (o de una habilidad asociada a una característica) para superar un desafío. Consulta también el capítulo “Cómo jugar” (“Las pruebas con d20” y “Competencia”)."
  }
 ],
 "source": {
  "book": "SRD 5.2.1 es",
  "page": 206
 }
}